{"$id":"urn:yeisme:schema:eikona.character_asset_prompt_authoring.v1","$schema":"https://json-schema.org/draft/2020-12/schema","additionalProperties":false,"properties":{"asset_profile_id":{"type":"string"},"continuity_constraints":{"type":"object"},"layout":{"type":"object"},"locale":{"type":"string"},"module_id":{"type":"string"},"module_refs":{"type":"object"},"output_schema_version":{"type":"string"},"qc_checklist":{"type":"array"},"reference_bindings":{"type":"object"},"schema_version":{"enum":["eikona.character_asset_prompt_input.v1","eikona.character_asset_prompt_modules.v1","character.module.v1","wardrobe.module.v1","task.module.v1","layout.module.v1","qc.module.v1"]},"style_lens_summary":{"type":"string"},"subject":{"type":"object"},"subject_version_ref":{"type":"string"},"task":{"type":"object"},"wardrobe":{"type":"object"}},"required":["schema_version"],"title":"AI Drama Character Asset Authoring Document v1","type":"object"}