{"asset_profile_id":"face-master-v1","continuity_constraints":{"adult_only":true,"neutral_expression":true,"no_mirror":true,"single_subject":true},"locale":"zh-CN","output_schema_version":"character_asset.prompt_bundle.v1","reference_bindings":{"identity_source":[],"pose_source":[],"style_source":["reference:style-soft-ink-color@v1"],"wardrobe_source":[]},"schema_version":"eikona.character_asset_prompt_input.v1","style_lens_summary":"清晰五官、低饱和自然肤色、柔和中性棚拍光，不引用具体创作者身份。","subject":{"adult":true,"identity_anchor":"年轻成年女性，椭圆脸，黑色长发低束，眉眼清晰","left_marker":"left-ear-small-silver-stud"},"subject_version_ref":"subject:wuxia-lan-01@v1","task":{"aspect_ratio":"4:5","background":"neutral-light-gray","execution_mode":"independent_artifacts","expression":"neutral","fixed_seed":42017,"framing":"bust","production":true,"provider_artifact_count_per_job":1,"seed_policy":"fixed","stage_id":"face-master-front","view_role":"detail","views":["detail"]},"wardrobe":{}}