{"asset_profile_id":"expression-sheet-v1","continuity_constraints":{"presentation_only_neckline":true,"same_base_hairline":true,"same_base_hairstyle":true,"same_capture":true,"same_identity":true},"locale":"zh-CN","output_schema_version":"character_asset.prompt_bundle.v1","reference_bindings":{"identity_source":["asset:face-master-qingyi-01@v1"],"must_not_influence":["expression","gaze","makeup","jewelry","wardrobe","background","dramatic_color_grade"],"pose_source":[],"style_source":["reference:style-neutral-studio@v1"],"wardrobe_source":[]},"schema_version":"eikona.character_asset_prompt_input.v1","style_lens_summary":"中性棚拍、真实皮肤层次、克制表演强度，不引用具体演员或创作者身份。","subject":{"accepted_face_master_ref":"asset:face-master-qingyi-01@v1","adult":true,"base_hairline":"soft-widows-peak","base_hairstyle":"low-tied-straight","identity_anchor":"成年青衣女性，椭圆脸，左眼下方一枚浅痣，黑色长发低束"},"subject_version_ref":"subject:qingyi-01@v1","task":{"capture_lock":{"camera_angle":"eye_level_front","exposure":"neutral","framing":"bust_to_shoulders","gaze_target":"camera","head_pitch":0,"head_roll":0,"head_scale":"0.42_frame_height","head_yaw":0,"key_light_direction":"camera_left_30deg"},"depiction_count":6,"expressions":[{"intensity":0,"label":"neutral","view_key":"view-expression-01-neutral"},{"intensity":2,"label":"reserved-smile","view_key":"view-expression-02-reserved-smile"},{"intensity":3,"label":"grief-held","view_key":"view-expression-03-grief-held"},{"intensity":3,"label":"cold-anger","view_key":"view-expression-04-cold-anger"},{"intensity":2,"label":"startled-fear","view_key":"view-expression-05-startled-fear"},{"intensity":4,"label":"resolve","view_key":"view-expression-06-resolve"}],"layout":"expression_contact_sheet_3x2","output_intent":"single_generated_grid","production":true,"seed_policy":"family_locked","subject_count":1},"wardrobe":{}}