{"asset_profile_id":"turnaround-three-view-v1","continuity_constraints":{"no_mirror":true,"same_body_ratio":true,"same_identity":true,"same_shoes":true,"same_wardrobe_layers":true},"locale":"zh-CN","output_schema_version":"character_asset.prompt_bundle.v1","reference_bindings":{"identity_source":["reference:identity-wuxia-lan@v1"],"pose_source":[],"style_source":["reference:style-soft-ink-color@v1"],"wardrobe_source":["reference:wardrobe-moonwhite@v1"]},"schema_version":"eikona.character_asset_prompt_input.v1","style_lens_summary":"清晰轮廓、低饱和月白与浅烟紫、柔和中性棚拍光，不引用具体创作者身份。","subject":{"adult":true,"body_ratio":"7.2 heads","identity_anchor":"年轻成年女性，椭圆脸，黑色长发低束，眉眼清晰","left_marker":"left-ear-small-silver-stud"},"subject_version_ref":"subject:wuxia-lan-01@v1","task":{"aspect_ratio":"2:3","background":"neutral-light-gray","depends_on":["face-master-front","body-master-front"],"execution_mode":"provider_generated_grid","fixed_seed":42017,"full_body_required":true,"marker_policy":"viewer-left-is-character-right","output_intent":"single_generated_grid","production":true,"provider_artifact_count_per_job":3,"review_layout":"turnaround_contact_sheet_1x3","seed_policy":"fixed","stage_order":["base-wardrobe-front","turnaround-left-profile","turnaround-back"],"views":["front","left_profile","back"]},"wardrobe":{"coverage":"胸背与腰部由不透明内层完整覆盖","inner_layer":"月白色不透明丝绸交领内衫","outer_layer":"浅烟紫半透明薄纱外衫","shoes":"米白色低帮帆布鞋","waist":"烟紫色窄腰封"}}