{"asset_profile_id":"shot-keyframe-v1","continuity_constraints":{"hair_state":"low-tied","prop_hand":"right","screen_direction":"left_to_right","sword_state":"sheathed"},"locale":"zh-CN","output_schema_version":"character_asset.prompt_bundle.v1","reference_bindings":{"identity_source":["reference:identity-wuxia-lan@v1"],"pose_source":["reference:pose-draw-sword-anticipation@v1"],"style_source":["reference:style-soft-ink-color@v1"],"wardrobe_source":["reference:wardrobe-moonwhite@v1"]},"schema_version":"eikona.character_asset_prompt_input.v1","style_lens_summary":"低饱和水墨色块、清晰动作轮廓、雨前冷光，不引用具体创作者身份。","subject":{"adult":true,"identity_anchor":"年轻成年女性，椭圆脸，黑色长发低束","screen_direction":"left_to_right"},"subject_version_ref":"subject:wuxia-lan-01@v1","task":{"action_phase":"anticipation","aspect_ratio":"9:16","camera_angle":"low_angle","location_ref":"location:mountain-gate@v1","shot_ref":"shot:episode-01/scene-02/shot-04","shot_size":"medium_full","story_event":"角色拔剑前压低重心，尚未出剑"},"wardrobe":{"inner_layer":"月白色不透明丝绸交领内衫","outer_layer":"浅烟紫薄纱外衫","shoes":"米白色低帮帆布鞋"}}